{
  "$schema": "https://json-schema.org/draft/2020-12/schema",
  "title": "AgentFactCheckingOutputSchema",
  "description": "Contrato formal de saída da análise do Agente de Fact-Checking e Verificação de Fontes.",
  "type": "object",
  "required": [
    "verified",
    "confidence",
    "justification",
    "broken_links"
  ],
  "properties": {
    "verified": {
      "type": "boolean",
      "description": "Resultado booleano final da esteira. True se todas as alegações forem sustentadas e sem links quebrados; False caso contrário."
    },
    "confidence": {
      "type": "number",
      "minimum": 0.0,
      "maximum": 1.0,
      "description": "Índice ponderado de confiança geral na verificação factual (0.00 a 1.00)."
    },
    "justification": {
      "type": "string",
      "minLength": 5,
      "maxLength": 5000,
      "description": "Explicação sintetizada da decisão do agente, descrevendo conformidade ou motivos de reprovação."
    },
    "broken_links": {
      "type": "array",
      "items": {
        "type": "string",
        "format": "uri"
      },
      "description": "Lista de URLs que falharam em responder com código HTTP válido ou violaram políticas de segurança."
    },
    "total_cards_inspected": {
      "type": "integer",
      "minimum": 0,
      "description": "Total de cartões factuais identificados e inspecionados no DOM."
    },
    "passed_cards": {
      "type": "integer",
      "minimum": 0,
      "description": "Quantidade de cartões cujas afirmações foram plenamente comprovadas."
    },
    "failed_cards": {
      "type": "integer",
      "minimum": 0,
      "description": "Quantidade de cartões rejeitados por incoerência semântica ou falta de fonte."
    },
    "claims_evaluated": {
      "type": "array",
      "description": "Detalhamento individual de cada cartão inspecionado.",
      "items": {
        "type": "object",
        "required": [
          "card_id",
          "claim_text",
          "verified",
          "confidence",
          "justification",
          "sources_checked"
        ],
        "properties": {
          "card_id": {
            "type": "string"
          },
          "title": {
            "type": "string"
          },
          "claim_text": {
            "type": "string"
          },
          "verified": {
            "type": "boolean"
          },
          "confidence": {
            "type": "number",
            "minimum": 0.0,
            "maximum": 1.0
          },
          "justification": {
            "type": "string"
          },
          "sources_checked": {
            "type": "array",
            "items": {
              "type": "object",
              "required": ["url", "status", "accessible"],
              "properties": {
                "url": { "type": "string" },
                "status": { "type": "integer" },
                "accessible": { "type": "boolean" },
                "details": { "type": "string" }
              }
            }
          }
        }
      }
    },
    "timestamp": {
      "type": "string",
      "format": "date-time",
      "description": "Data e hora ISO 8601 da execução do pipeline."
    }
  }
}
