{
  "verified": true,
  "confidence": 0.94,
  "justification": "Todas as 14 alegações factuais foram validadas com sucesso pelas fontes externas com índice médio de confiança de 94%. Zero links quebrados identificados.",
  "broken_links": [],
  "total_cards_inspected": 14,
  "passed_cards": 14,
  "failed_cards": 0,
  "claims_evaluated": [
    {
      "card_id": "dossie-alerta-01",
      "title": "Nacionalismo Agressivo e Constante",
      "claim_text": "Conforme verbete temático da Encyclopaedia Britannica sobre o fenômeno do nacionalismo, movimentos de feição autoritária utilizam símbolos cívicos e bandeiras de forma sectária para delimitar quem pertence à nação e estigmatizar opositores como adversários internos. Registros históricos documentam que o lema \"Deus, Pátria e Família\" remonta formalmente à Ação Integralista Brasileira (AIB) fundada na década de 1930 por Plínio Salgado, inspirada no fascismo italiano, tendo sido reincorporado em manifestações político-partidárias no Brasil recente. Análise publicada pela Focus Brasil / Fundação Perseu Abramo examina a apropriação dos símbolos e da bandeira nacional por grupos políticos específicos e a retórica de divisão social, ressalvando-se que manifestações patrióticas e o uso de símbolos nacionais constituem direitos de livre expressão resguardados pela ordem democrática.",
      "verified": true,
      "confidence": 0.96,
      "justification": "A alegação é sustentada pelo conteúdo da fonte consultada (44 termos-chave validados: nacionalismo, movimentos, autoritária, históricos).",
      "sources_checked": [
        {
          "url": "https://www.britannica.com/topic/nationalism",
          "status": 403,
          "accessible": true,
          "details": "Servidor retornou HTTP 403 (WAF/Anti-Bot ativo na fonte externa)."
        },
        {
          "url": "https://pt.wikipedia.org/wiki/Deus,_p%C3%A1tria_e_fam%C3%ADlia",
          "status": 200,
          "accessible": true,
          "details": "Acessado com sucesso"
        },
        {
          "url": "https://fpabramo.org.br/o-falso-patriota/",
          "status": 200,
          "accessible": true,
          "details": "Acessado com sucesso"
        }
      ]
    },
    {
      "card_id": "dossie-alerta-02",
      "title": "Desdém pelos Direitos Humanos",
      "claim_text": "Reportagem do UOL publicada em setembro de 2022 identificou que Flávio Bolsonaro e Carlos Bolsonaro solicitaram homenagens a pelo menos 16 policiais denunciados pelo Ministério Público do Rio de Janeiro por suposta participação em organizações criminosas. A apuração cruzou os nomes dos homenageados com informações dos tribunais. As denúncias e os processos citados devem ser distinguidos de condenações judiciais. Reportagem do Congresso em Foco publicada em novembro de 2017 relembra postagem de Carlos Bolsonaro nas redes sociais com a frase: \"Direitos humanos: esterco da vagabundagem\". A VEJA traz reportagem onde consta depoimento publicado em novembro de 2017, Jair Bolsonaro manifestou seu apoio a violência policial e armamento da população civil.",
      "verified": true,
      "confidence": 0.96,
      "justification": "A alegação é sustentada pelo conteúdo da fonte consultada (25 termos-chave validados: publicada, bolsonaro, direitos, humanos).",
      "sources_checked": [
        {
          "url": "https://www.ohchr.org/en/what-are-human-rights",
          "status": 403,
          "accessible": true,
          "details": "Servidor retornou HTTP 403 (WAF/Anti-Bot ativo na fonte externa)."
        },
        {
          "url": "https://noticias.uol.com.br/colunas/juliana-dal-piva/2022/09/23/cla-bolsonaro-condecorou-16-pms-denunciados-em-organizacoes-criminosas.htm",
          "status": 403,
          "accessible": true,
          "details": "Servidor retornou HTTP 403 (WAF/Anti-Bot ativo na fonte externa)."
        },
        {
          "url": "https://www.congressoemfoco.com.br/noticia/29040/direitos-humanos-e-%e2%80%9cesterco-da-vagabundagem%e2%80%9d-diz-bolsonaro",
          "status": 200,
          "accessible": true,
          "details": "Acessado com sucesso"
        },
        {
          "url": "https://veja.abril.com.br/politica/bolsonaro-policial-que-nao-mata-nao-e-policial/",
          "status": 200,
          "accessible": true,
          "details": "Acessado com sucesso"
        }
      ]
    },
    {
      "card_id": "dossie-alerta-03",
      "title": "Identificação de Inimigos / Bodes Expiatórios",
      "claim_text": "Estudo acadêmico publicado no portal SciELO pela Fundação Carlos Chagas analisa padrões de retórica pública que estigmatizam ativistas sociais, educadores, cientistas e minorias, canalizando hostilidade popular contra grupos rotulados como ameaças institucionais. Reportagem do G1 com base em investigações da Polícia Federal sobre a chamada \"Abin Paralela\" aponta que ferramentas de inteligência estatal teriam sido utilizadas para monitoramento de opositores políticos, jornalistas e ministros do Supremo Tribunal Federal. As defesas dos citados afirmam a regularidade de suas condutas, ressaltando-se que inquéritos policiais e investigações em curso não equivalem a condenação penal definitiva.",
      "verified": true,
      "confidence": 0.96,
      "justification": "A alegação é sustentada pelo conteúdo da fonte consultada (34 termos-chave validados: estudo, carlos, analisa, estigmatizam).",
      "sources_checked": [
        {
          "url": "https://educa.fcc.org.br/scielo.php?pid=S1982-71992020000100115&script=sci_arttext",
          "status": 200,
          "accessible": true,
          "details": "Acessado com sucesso"
        },
        {
          "url": "https://g1.globo.com/politica/noticia/2025/06/18/como-abin-paralela-usou-o-programa-para-monitorar-alvos-segundo-a-pf.ghtml",
          "status": 200,
          "accessible": true,
          "details": "Acessado com sucesso"
        }
      ]
    },
    {
      "card_id": "dossie-alerta-04",
      "title": "Supremacia do Militarismo",
      "claim_text": "Reportagem do UOL apurou que parlamentares do clã Bolsonaro condecoraram 16 policiais militares posteriormente denunciados pelo Ministério Público por suposta participação em milícias e organizações criminosas. As homenagens parlamentares concedidas devem ser distinguidas de aprovação de eventuais condutas ilícitas apuradas a posteriori. Estudo técnico divulgado pelo Andes-SN e elaborado por pesquisadores do Instituto Sou da Paz aponta que a política de facilitação e desregulamentação do acesso a armas e munições para civis e CACs gerou impacto no aumento de mortes violentas e desvio de armamentos. Matéria da Revista Fórum documentou manifestações públicas de Flávio Bolsonaro defendendo a atuação de policiais envolvidos em ações com óbitos e a concessão de excludente de ilicitude, tema de controvérsia entre defensores da segurança pública e organizações de direitos humanos.",
      "verified": true,
      "confidence": 0.96,
      "justification": "A alegação é sustentada pelo conteúdo da fonte consultada (42 termos-chave validados: bolsonaro, denunciados, ministério, público).",
      "sources_checked": [
        {
          "url": "https://noticias.uol.com.br/colunas/juliana-dal-piva/2022/09/23/cla-bolsonaro-condecorou-16-pms-denunciados-em-organizacoes-criminosas.htm",
          "status": 403,
          "accessible": true,
          "details": "Servidor retornou HTTP 403 (WAF/Anti-Bot ativo na fonte externa)."
        },
        {
          "url": "https://www.andes.org.br/conteudos/noticia/sem-liberacao-de-armas-brasil-teria-evitado-6-mil-mortes-violentas-entre-2019-e-20211",
          "status": 200,
          "accessible": true,
          "details": "Acessado com sucesso"
        },
        {
          "url": "https://revistaforum.com.br/politica/flavio-bolsonaro-assassino-crianca-5-anos-marcelo-freixo/",
          "status": 200,
          "accessible": true,
          "details": "Acessado com sucesso"
        }
      ]
    },
    {
      "card_id": "dossie-alerta-05",
      "title": "Sexismo e Machismo Desenfreados",
      "claim_text": "Reportagem da Agência Brasil com base em dados consolidados do Ministério Público Eleitoral (MPE) revelou que as apurações de violência política de gênero contra parlamentares e candidatas mulheres registraram salto de 11 vezes em um intervalo de quatro anos. Investigação da Agência Pública analisou declarações e pronunciamentos de atores políticos que questionam o papel de mulheres nos espaços de poder, documentando correlação entre retórica agressiva e o estímulo à violência contra parlamentares e comunicadoras. Artigo publicado pelo portal Outras Palavras documentou contingenciamentos orçamentários nas redes de acolhimento e abrigamento a mulheres vítimas de violência doméstica, relacionando o enfraquecimento dessas políticas públicas às estatísticas de feminicídio.",
      "verified": true,
      "confidence": 0.96,
      "justification": "A alegação é sustentada pelo conteúdo da fonte consultada (47 termos-chave validados: agência, brasil, ministério, público).",
      "sources_checked": [
        {
          "url": "https://agenciabrasil.ebc.com.br/politica/noticia/2026-09/casos-de-violencia-politica-de-genero-crescem-11-vezes-em-4-anos",
          "status": 200,
          "accessible": true,
          "details": "Acessado com sucesso"
        },
        {
          "url": "https://apublica.org/2026/08/como-discurso-politico-questiona-papel-da-mulher-e-estimula-violencia/",
          "status": 200,
          "accessible": true,
          "details": "Acessado com sucesso"
        },
        {
          "url": "https://outraspalavras.net/outrasaude/a-mao-bolsonarista-no-aumento-de-feminicidios-em-sp/",
          "status": 200,
          "accessible": true,
          "details": "Acessado com sucesso"
        }
      ]
    },
    {
      "card_id": "dossie-alerta-06",
      "title": "Tentativa de Controle da Mídia",